{
  "reportType": "ux-capability-matrix",
  "schemaVersion": 1,
  "matrixId": "windows-11-24h2-supported",
  "capabilities": [
    {
      "id": "win11-24h2-default-user-default-apps",
      "displayVersion": "24H2",
      "buildMin": 26100,
      "buildMax": 26199,
      "scope": "default-user",
      "feature": "default-apps",
      "supportStatus": "planned-supported",
      "verificationMode": "future-real-verification",
      "mutationAllowed": false
    },
    {
      "id": "win11-24h2-current-user-start-menu",
      "displayVersion": "24H2",
      "buildMin": 26100,
      "buildMax": 26199,
      "scope": "current-user",
      "feature": "start-menu",
      "supportStatus": "manual-or-future",
      "verificationMode": "manual-checklist",
      "mutationAllowed": false
    }
  ]
}
